<?xml version="1.0" encoding="ISO-8859-1"?>
<tvschedule name="ocn" xmlns:xsi="http://www.w3.org/2001/XMLSchema-instance" 
xsi:noNamespaceSchemaLocation="tvschedule.xsd">
<channel chan="52">
<banner>movie</banner>
<day>
<date>09/13</date>
<holiday>sat</holiday>
</day>
</channel>
<channel chan="53">
<banner>movie1</banner>
<day>
<date>09/14</date>
<programslot vtr="umm">
<time>18:00</time>
<title rating="1" language="eng"></title>
<description>hmm</description>
</programslot>
</day>
</channel>
</tvschedule>